sl_no,district,tfc_number,centre_name,address,full_address,search_query,google_maps_url,latitude,longitude,geocode_provider,geocode_address,geocode_status
53,Madurai,79,Government Polytechnic College,Usilampatti-625537,"Government Polytechnic College, Usilampatti-625537","Government Polytechnic College, Usilampatti-625537, Madurai, Tamil Nadu, India",https://www.google.com/maps/search/?api=1&query=Government+Polytechnic+College%2C+Usilampatti-625537%2C+Madurai%2C+Tamil+Nadu%2C+India,9.960251,78.415888,arcgis,Government Polytechnic College,resolved
54,Madurai,80,Government Polytechnic College,"Chekkanurani, Madurai","Government Polytechnic College, Chekkanurani, Madurai","Government Polytechnic College, Chekkanurani, Madurai, Tamil Nadu, India",https://www.google.com/maps/search/?api=1&query=Government+Polytechnic+College%2C+Chekkanurani%2C+Madurai%2C+Tamil+Nadu%2C+India,9.960251,78.415888,arcgis,Government Polytechnic College,resolved
55,Madurai,81,Anna University Regional Campus Madurai,"Keelakuildi, Madurai - 625019","Anna University Regional Campus Madurai, Keelakuildi, Madurai - 625019","Anna University Regional Campus Madurai, Keelakuildi, Madurai - 625019, Tamil Nadu, India",https://www.google.com/maps/search/?api=1&query=Anna+University+Regional+Campus+Madurai%2C+Keelakuildi%2C+Madurai+-+625019%2C+Tamil+Nadu%2C+India,9.93291,78.069873,arcgis,"625019, Madurai South, Tamil Nadu",resolved
56,Mayiladuthurai,52,Srinivasa Subbaraya Polytechnic College,"Puthur, Sirkali, Mayiladuthurai District-, 609108","Srinivasa Subbaraya Polytechnic College, Puthur, Sirkali, Mayiladuthurai District- 609108","Srinivasa Subbaraya Polytechnic College, Puthur, Sirkali, Mayiladuthurai District- 609108, Tamil Nadu, India",https://www.google.com/maps/search/?api=1&query=Srinivasa+Subbaraya+Polytechnic+College%2C+Puthur%2C+Sirkali%2C+Mayiladuthurai+District-+609108%2C+Tamil+Nadu%2C+India,11.3303196,79.7189302,arcgis,"609108, Sirkazhi, Tamil Nadu",resolved
57,Nagapattinam,36,Valivalam Desikar Polytechnic College,"Collectorate (Po), Nagapattinam, 611001","Valivalam Desikar Polytechnic College, Collectorate (Po), Nagapattinam, 611001","Valivalam Desikar Polytechnic College, Collectorate (Po), Nagapattinam, 611001, Tamil Nadu, India",https://www.google.com/maps/search/?api=1&query=Valivalam+Desikar+Polytechnic+College%2C+Collectorate+%28Po%29%2C+Nagapattinam%2C+611001%2C+Tamil+Nadu%2C+India,10.794061,79.836541,arcgis,Valivalam Desikar Polytechnic College,resolved
58,Nagapattinam,82,University College of Engineering,"Thirukkuvalai, Nagappattinam - 610204","University College of Engineering, Thirukkuvalai, Nagappattinam - 610204","University College of Engineering, Thirukkuvalai, Nagappattinam - 610204, Nagapattinam, Tamil Nadu, India",https://www.google.com/maps/search/?api=1&query=University+College+of+Engineering%2C+Thirukkuvalai%2C+Nagappattinam+-+610204%2C+Nagapattinam%2C+Tamil+Nadu%2C+India,10.6411275,79.7408938,arcgis,"610204, Thirukkuvalai, Tamil Nadu",resolved
59,Namakkal,27,Namakkal Kavignar Government Arts College,"For Women, Namakkal 637001","Namakkal Kavignar Government Arts College For Women, Namakkal 637001","Namakkal Kavignar Government Arts College For Women, Namakkal 637001, Tamil Nadu, India",https://www.google.com/maps/search/?api=1&query=Namakkal+Kavignar+Government+Arts+College+For+Women%2C+Namakkal+637001%2C+Tamil+Nadu%2C+India,11.214694,78.172741,arcgis,Ramalingam Government Art College For Womens,resolved
60,Namakkal,84,"Government Polytechnic College, Mohanur",Namakkal - 637015,"Government Polytechnic College, Mohanur, Namakkal - 637015","Government Polytechnic College, Mohanur, Namakkal - 637015, Tamil Nadu, India",https://www.google.com/maps/search/?api=1&query=Government+Polytechnic+College%2C+Mohanur%2C+Namakkal+-+637015%2C+Tamil+Nadu%2C+India,11.061073,78.138695,arcgis,"637015, Mohanur, Tamil Nadu",resolved
61,Perambalur,40,Government Polytechnic,"College,Perambalur-621104","Government Polytechnic College,Perambalur-621104","Government Polytechnic College,Perambalur-621104, Tamil Nadu, India",https://www.google.com/maps/search/?api=1&query=Government+Polytechnic+College%2CPerambalur-621104%2C+Tamil+Nadu%2C+India,13.0936722,80.2470185,arcgis,Government Polytechnic College,resolved
62,Pudukottai,43,"Govt Polytechnic College , Aranthangi",614616,"Govt Polytechnic College, Aranthangi 614616","Govt Polytechnic College, Aranthangi 614616, Pudukottai, Tamil Nadu, India",https://www.google.com/maps/search/?api=1&query=Govt+Polytechnic+College%2C+Aranthangi+614616%2C+Pudukottai%2C+Tamil+Nadu%2C+India,10.156531,78.998331,arcgis,Government Polytechnic College,resolved
63,Pudukottai,86,Government Polytechnic College,"Gandharvakottai, Pudupatti Village - 613301.","Government Polytechnic College, Gandharvakottai, Pudupatti Village - 613301.","Government Polytechnic College, Gandharvakottai, Pudupatti Village - 613301., Pudukottai, Tamil Nadu, India",https://www.google.com/maps/search/?api=1&query=Government+Polytechnic+College%2C+Gandharvakottai%2C+Pudupatti+Village+-+613301.%2C+Pudukottai%2C+Tamil+Nadu%2C+India,10.573184,79.0130959,arcgis,"613301, Gandarvakottai, Tamil Nadu",resolved
64,Ramanathapuram,33,"Government Arts College, Paramakudi - 623",701.,"Government Arts College, Paramakudi - 623701.","Government Arts College, Paramakudi - 623701., Ramanathapuram, Tamil Nadu, India",https://www.google.com/maps/search/?api=1&query=Government+Arts+College%2C+Paramakudi+-+623701.%2C+Ramanathapuram%2C+Tamil+Nadu%2C+India,9.530881,78.603657,arcgis,Government Arts College Paramagudi,resolved
65,Ramanathapuram,87,University College of Engineering,"Ramanathapuram, Pullangudi, Ramanathapuram 623513","University College of Engineering Ramanathapuram, Pullangudi, Ramanathapuram 623513","University College of Engineering Ramanathapuram, Pullangudi, Ramanathapuram 623513, Tamil Nadu, India",https://www.google.com/maps/search/?api=1&query=University+College+of+Engineering+Ramanathapuram%2C+Pullangudi%2C+Ramanathapuram+623513%2C+Tamil+Nadu%2C+India,9.452826,78.898087,arcgis,"623513, Ramanathapuram, Tamil Nadu",resolved
66,Ranipet,11,Arignar Anna Government Arts College for,"Women, Walajapet, Ranipet Dt -632513","Arignar Anna Government Arts College for Women, Walajapet, Ranipet Dt -632513","Arignar Anna Government Arts College for Women, Walajapet, Ranipet Dt -632513, Tamil Nadu, India",https://www.google.com/maps/search/?api=1&query=Arignar+Anna+Government+Arts+College+for+Women%2C+Walajapet%2C+Ranipet+Dt+-632513%2C+Tamil+Nadu%2C+India,12.922361,79.376611,arcgis,Arignar Anna Government Arts College,resolved
67,Salem,19,"Government College of Engineering, Salem",636011,"Government College of Engineering, Salem, 636011","Government College of Engineering, Salem, 636011, Tamil Nadu, India",https://www.google.com/maps/search/?api=1&query=Government+College+of+Engineering%2C+Salem%2C+636011%2C+Tamil+Nadu%2C+India,11.712701,78.088901,arcgis,Government College Of Engineering,resolved
68,Salem,88,"Government Polytechnic College, Vanavasi",Salem-636457,"Government Polytechnic College, Vanavasi, Salem-636457","Government Polytechnic College, Vanavasi, Salem-636457, Tamil Nadu, India",https://www.google.com/maps/search/?api=1&query=Government+Polytechnic+College%2C+Vanavasi%2C+Salem-636457%2C+Tamil+Nadu%2C+India,11.750052,77.882607,arcgis,"636457, Vanavasi, Tamil Nadu",resolved
69,Salem,89,"Thiagarajar Polytechnic College, Junction","Main Road, Salem - 636005","Thiagarajar Polytechnic College, Junction Main Road, Salem - 636005","Thiagarajar Polytechnic College, Junction Main Road, Salem - 636005, Tamil Nadu, India",https://www.google.com/maps/search/?api=1&query=Thiagarajar+Polytechnic+College%2C+Junction+Main+Road%2C+Salem+-+636005%2C+Tamil+Nadu%2C+India,11.674939,78.125084,arcgis,Thiagarajar Polytechnic College,resolved
70,Sivagangai,45,Alagappa Chettiar Government College of,"Engineering And Technology, Karaikudi, 630003","Alagappa Chettiar Government College of Engineering And Technology, Karaikudi 630003","Alagappa Chettiar Government College of Engineering And Technology, Karaikudi 630003, Sivagangai, Tamil Nadu, India",https://www.google.com/maps/search/?api=1&query=Alagappa+Chettiar+Government+College+of+Engineering+And+Technology%2C+Karaikudi+630003%2C+Sivagangai%2C+Tamil+Nadu%2C+India,10.078757,78.7935506,arcgis,"630003, Subramaniapuram, Tamil Nadu",resolved
71,Sivagangai,90,Alagappa Government Polytechnic College,Karaikudi - 630003.,"Alagappa Government Polytechnic College, Karaikudi - 630003.","Alagappa Government Polytechnic College, Karaikudi - 630003., Sivagangai, Tamil Nadu, India",https://www.google.com/maps/search/?api=1&query=Alagappa+Government+Polytechnic+College%2C+Karaikudi+-+630003.%2C+Sivagangai%2C+Tamil+Nadu%2C+India,10.078757,78.7935506,arcgis,"630003, Subramaniapuram, Tamil Nadu",resolved
72,Sivagangai,91,"Annamalai Polytechnic College,Chettinad -",630102,"Annamalai Polytechnic College,Chettinad - 630102","Annamalai Polytechnic College,Chettinad - 630102, Sivagangai, Tamil Nadu, India",https://www.google.com/maps/search/?api=1&query=Annamalai+Polytechnic+College%2CChettinad+-+630102%2C+Sivagangai%2C+Tamil+Nadu%2C+India,10.159184,78.779076,arcgis,Annamalai Polytechnic College Hostel,resolved
73,Tenkasi,47,Government Arts And Science College,Kadayanallur,"Government Arts And Science College, Kadayanallur","Government Arts And Science College, Kadayanallur, Tenkasi, Tamil Nadu, India",https://www.google.com/maps/search/?api=1&query=Government+Arts+And+Science+College%2C+Kadayanallur%2C+Tenkasi%2C+Tamil+Nadu%2C+India,11.196294,77.286439,arcgis,Government Arts And Science College,resolved
74,Tenkasi,59,Kamarajar Government Arts College,"Surandai, Tenkasi - 627859","Kamarajar Government Arts College, Surandai, Tenkasi - 627859","Kamarajar Government Arts College, Surandai, Tenkasi - 627859, Tamil Nadu, India",https://www.google.com/maps/search/?api=1&query=Kamarajar+Government+Arts+College%2C+Surandai%2C+Tenkasi+-+627859%2C+Tamil+Nadu%2C+India,8.977251,77.422226,arcgis,"627859, Surandai, Tamil Nadu",resolved
75,Thanjavur,37,Government Polytechnic College,Papanasam 61420,"Government Polytechnic College, Papanasam 61420","Government Polytechnic College, Papanasam 61420, Thanjavur, Tamil Nadu, India",https://www.google.com/maps/search/?api=1&query=Government+Polytechnic+College%2C+Papanasam+61420%2C+Thanjavur%2C+Tamil+Nadu%2C+India,10.927176,79.265358,arcgis,"Papanasam, Thanjavur, Tamil Nadu",resolved
76,Thanjavur,38,Govt. College of Engineering Sengipatti,Thanjavur - 613402,"Govt. College of Engineering Sengipatti, Thanjavur - 613402","Govt. College of Engineering Sengipatti, Thanjavur - 613402, Tamil Nadu, India",https://www.google.com/maps/search/?api=1&query=Govt.+College+of+Engineering+Sengipatti%2C+Thanjavur+-+613402%2C+Tamil+Nadu%2C+India,10.6940673,78.9766654,arcgis,Government College Of Engineering,resolved
77,Thanjavur,92,University College of Engineering,"Pattukkottai, ECR Road, Rajamadam.614701","University College of Engineering Pattukkottai, ECR Road, Rajamadam.614701","University College of Engineering Pattukkottai, ECR Road, Rajamadam.614701, Thanjavur, Tamil Nadu, India",https://www.google.com/maps/search/?api=1&query=University+College+of+Engineering+Pattukkottai%2C+ECR+Road%2C+Rajamadam.614701%2C+Thanjavur%2C+Tamil+Nadu%2C+India,10.339503,79.384972,arcgis,"614701, Adiramapattinam, Tamil Nadu",resolved
78,The Nilgiris,26,"Government Arts College, Udhagamandalam",- 643002. The Nilgiris.,"Government Arts College, Udhagamandalam - 643002. The Nilgiris.","Government Arts College, Udhagamandalam - 643002. The Nilgiris., Tamil Nadu, India",https://www.google.com/maps/search/?api=1&query=Government+Arts+College%2C+Udhagamandalam+-+643002.+The+Nilgiris.%2C+Tamil+Nadu%2C+India,11.4109165,76.7166456,arcgis,Government Arts College,resolved
79,The Nilgiris,85,Government Polytechnic College,"Udhagamandalam, Finger Post, Ooty, The, Nilgiris643006","Government Polytechnic College, Udhagamandalam, Finger Post, Ooty, The Nilgiris643006","Government Polytechnic College, Udhagamandalam, Finger Post, Ooty, The Nilgiris643006, Tamil Nadu, India",https://www.google.com/maps/search/?api=1&query=Government+Polytechnic+College%2C+Udhagamandalam%2C+Finger+Post%2C+Ooty%2C+The+Nilgiris643006%2C+Tamil+Nadu%2C+India,11.420334,76.676653,arcgis,Udagamandalam Government Polytechnic College,resolved
80,Theni,35,Government College of Engineering,Bodinayakkanur-Theni District 625582,"Government College of Engineering, Bodinayakkanur-Theni District 625582","Government College of Engineering, Bodinayakkanur-Theni District 625582, Tamil Nadu, India",https://www.google.com/maps/search/?api=1&query=Government+College+of+Engineering%2C+Bodinayakkanur-Theni+District+625582%2C+Tamil+Nadu%2C+India,9.994671,77.349313,arcgis,Government Engineering Collage,resolved
81,Theni,93,"Government Polytechnic College, Theni -",625534,"Government Polytechnic College, Theni - 625534","Government Polytechnic College, Theni - 625534, Tamil Nadu, India",https://www.google.com/maps/search/?api=1&query=Government+Polytechnic+College%2C+Theni+-+625534%2C+Tamil+Nadu%2C+India,9.956787,77.533852,arcgis,Government Polytechnic College,resolved
82,Theni,94,"Government Polytechnic College,Aundipatti-",625517,"Government Polytechnic College,Aundipatti- 625517","Government Polytechnic College,Aundipatti- 625517, Theni, Tamil Nadu, India",https://www.google.com/maps/search/?api=1&query=Government+Polytechnic+College%2CAundipatti-+625517%2C+Theni%2C+Tamil+Nadu%2C+India,9.956787,77.533852,arcgis,Government Polytechnic College,resolved
83,Thiruvallur,9,Murugappa Polytechnic College,"Sathyamurthy Nagar, Avadi, Chennai -, 600062","Murugappa Polytechnic College, Sathyamurthy Nagar, Avadi, Chennai - 600062","Murugappa Polytechnic College, Sathyamurthy Nagar, Avadi, Chennai - 600062, Thiruvallur, Tamil Nadu, India",https://www.google.com/maps/search/?api=1&query=Murugappa+Polytechnic+College%2C+Sathyamurthy+Nagar%2C+Avadi%2C+Chennai+-+600062%2C+Thiruvallur%2C+Tamil+Nadu%2C+India,13.1722355,80.1060797,arcgis,"600062, Ambattur, Tamil Nadu",resolved
84,Thiruvallur,10,Loganatha Narayanasamy Government,"College (A), Ponneri","Loganatha Narayanasamy Government College (A), Ponneri","Loganatha Narayanasamy Government College (A), Ponneri, Thiruvallur, Tamil Nadu, India",https://www.google.com/maps/search/?api=1&query=Loganatha+Narayanasamy+Government+College+%28A%29%2C+Ponneri%2C+Thiruvallur%2C+Tamil+Nadu%2C+India,13.3306445,80.1951644,arcgis,Loganathan Narayanasamy Government College,resolved
85,Thiruvallur,96,"Government Polytechnic College, Sevapettai",Thiruvallur. 602025,"Government Polytechnic College, Sevapettai, Thiruvallur. 602025","Government Polytechnic College, Sevapettai, Thiruvallur. 602025, Tamil Nadu, India",https://www.google.com/maps/search/?api=1&query=Government+Polytechnic+College%2C+Sevapettai%2C+Thiruvallur.+602025%2C+Tamil+Nadu%2C+India,13.1272,79.9694,arcgis,"602025, Sevvapettai, Tiruvallur, Tamil Nadu",resolved
86,Thiruvallur,97,AMK Technological Polytechnic College,"Chennai-Banglore High Road, Sembarambakkam-600123","AMK Technological Polytechnic College, Chennai-Banglore High Road, Sembarambakkam-600123","AMK Technological Polytechnic College, Chennai-Banglore High Road, Sembarambakkam-600123, Thiruvallur, Tamil Nadu, India",https://www.google.com/maps/search/?api=1&query=AMK+Technological+Polytechnic+College%2C+Chennai-Banglore+High+Road%2C+Sembarambakkam-600123%2C+Thiruvallur%2C+Tamil+Nadu%2C+India,13.036677,80.052371,arcgis,Amk Technological Polytechnic College,resolved
87,Thiruvarur,44,"Government Polytechnic College, Thozhuvur","Colony, Valangaiman. Thiruvarur District. Pin, - 612804","Government Polytechnic College, Thozhuvur Colony, Valangaiman. Thiruvarur District. Pin - 612804","Government Polytechnic College, Thozhuvur Colony, Valangaiman. Thiruvarur District. Pin - 612804, Tamil Nadu, India",https://www.google.com/maps/search/?api=1&query=Government+Polytechnic+College%2C+Thozhuvur+Colony%2C+Valangaiman.+Thiruvarur+District.+Pin+-+612804%2C+Tamil+Nadu%2C+India,10.889647,79.393555,arcgis,"612804, Valangiman, Tamil Nadu",resolved
88,Thiruvarur,99,"Government Polytechnic College, Korukkai -",614711,"Government Polytechnic College, Korukkai - 614711","Government Polytechnic College, Korukkai - 614711, Thiruvarur, Tamil Nadu, India",https://www.google.com/maps/search/?api=1&query=Government+Polytechnic+College%2C+Korukkai+-+614711%2C+Thiruvarur%2C+Tamil+Nadu%2C+India,10.5146431,79.694747,arcgis,"614711, Tirutturaipundi, Tamil Nadu",resolved
89,Thoothukudi,50,Government Polytechnic College,"Palayamkottai Road, Thoothukudi -628008","Government Polytechnic College, Palayamkottai Road, Thoothukudi -628008","Government Polytechnic College, Palayamkottai Road, Thoothukudi -628008, Tamil Nadu, India",https://www.google.com/maps/search/?api=1&query=Government+Polytechnic+College%2C+Palayamkottai+Road%2C+Thoothukudi+-628008%2C+Tamil+Nadu%2C+India,8.791001,78.120101,arcgis,Government Polytechnic College,resolved
90,Thoothukudi,103,Bharathiyar Centenary Memorial Women’s,"Polytechnic College, Ettayapuram - 628902.","Bharathiyar Centenary Memorial Women’s Polytechnic College, Ettayapuram - 628902.","Bharathiyar Centenary Memorial Women’s Polytechnic College, Ettayapuram - 628902., Thoothukudi, Tamil Nadu, India",https://www.google.com/maps/search/?api=1&query=Bharathiyar+Centenary+Memorial+Women%E2%80%99s+Polytechnic+College%2C+Ettayapuram+-+628902.%2C+Thoothukudi%2C+Tamil+Nadu%2C+India,9.144239,78.044848,arcgis,"628902, Ettaiyapuram, Tamil Nadu",resolved
91,Thoothukudi,104,University VOC College of Engineering,Thoothukudi,"University VOC College of Engineering, Thoothukudi","University VOC College of Engineering, Thoothukudi, Tamil Nadu, India",https://www.google.com/maps/search/?api=1&query=University+VOC+College+of+Engineering%2C+Thoothukudi%2C+Tamil+Nadu%2C+India,8.795181,78.129001,arcgis,V O C College,resolved
92,Tiruchirappalli,41,Government Polytechnic College,"Thuvakudimalai, Trichy","Government Polytechnic College, Thuvakudimalai, Trichy","Government Polytechnic College, Thuvakudimalai, Trichy, Tiruchirappalli, Tamil Nadu, India",https://www.google.com/maps/search/?api=1&query=Government+Polytechnic+College%2C+Thuvakudimalai%2C+Trichy%2C+Tiruchirappalli%2C+Tamil+Nadu%2C+India,10.766497,78.803512,arcgis,Government Polytechnic College,resolved
93,Tiruchirappalli,42,Government College of Engineering,"Srirangam, Trichy - 620012","Government College of Engineering Srirangam, Trichy - 620012","Government College of Engineering Srirangam, Trichy - 620012, Tiruchirappalli, Tamil Nadu, India",https://www.google.com/maps/search/?api=1&query=Government+College+of+Engineering+Srirangam%2C+Trichy+-+620012%2C+Tiruchirappalli%2C+Tamil+Nadu%2C+India,10.7100861,78.5989012,arcgis,"620012, Srirangam, Tamil Nadu",resolved
94,Tiruchirappalli,100,Government Polytechnic College Srirangam,Trichy 620012,Government Polytechnic College Srirangam Trichy 620012,"Government Polytechnic College Srirangam Trichy 620012, Tiruchirappalli, Tamil Nadu, India",https://www.google.com/maps/search/?api=1&query=Government+Polytechnic+College+Srirangam+Trichy+620012%2C+Tiruchirappalli%2C+Tamil+Nadu%2C+India,10.766497,78.803512,arcgis,Government Polytechnic College,resolved
95,Tiruchirappalli,101,University College of Engineering (BIT-,"Campus) Anna University Tiruchirappalli -, 620024)",University College of Engineering (BIT- Campus) Anna University Tiruchirappalli - 620024),"University College of Engineering (BIT- Campus) Anna University Tiruchirappalli - 620024), Tamil Nadu, India",https://www.google.com/maps/search/?api=1&query=University+College+of+Engineering+%28BIT-+Campus%29+Anna+University+Tiruchirappalli+-+620024%29%2C+Tamil+Nadu%2C+India,10.6672503,78.7396558,arcgis,"620024, Thiruverumbur, Tamil Nadu",resolved
96,Tirunelveli,48,Government College of Engineering,Tirunelveli - 627007,"Government College of Engineering, Tirunelveli - 627007","Government College of Engineering, Tirunelveli - 627007, Tamil Nadu, India",https://www.google.com/maps/search/?api=1&query=Government+College+of+Engineering%2C+Tirunelveli+-+627007%2C+Tamil+Nadu%2C+India,8.685151,77.726601,arcgis,Government College of Engineering,resolved
97,Tirunelveli,49,Rani Anna Government College For Women,"Gandhinagar, Tirunelveli -627008","Rani Anna Government College For Women, Gandhinagar, Tirunelveli -627008","Rani Anna Government College For Women, Gandhinagar, Tirunelveli -627008, Tamil Nadu, India",https://www.google.com/maps/search/?api=1&query=Rani+Anna+Government+College+For+Women%2C+Gandhinagar%2C+Tirunelveli+-627008%2C+Tamil+Nadu%2C+India,8.7328,77.6588,arcgis,"627008, Gandhi Nagar, Tirunelveli, Tamil Nadu",resolved
98,Tirunelveli,95,Anna University Regional Campus-,"Tirunelveli, Trivandrum Road, Palayamkottai, Tirunelveli-627007","Anna University Regional Campus- Tirunelveli, Trivandrum Road, Palayamkottai, Tirunelveli-627007","Anna University Regional Campus- Tirunelveli, Trivandrum Road, Palayamkottai, Tirunelveli-627007, Tamil Nadu, India",https://www.google.com/maps/search/?api=1&query=Anna+University+Regional+Campus-+Tirunelveli%2C+Trivandrum+Road%2C+Palayamkottai%2C+Tirunelveli-627007%2C+Tamil+Nadu%2C+India,8.7115541,77.7314141,arcgis,"Trivandrum Road, Palayankottai, Rajendra Nagar, Tirunelveli, Tamil Nadu, 627007",resolved
99,Tirupathur,13,"Government Polytechnic College, Jolarpet",Thirupathur - 635651,"Government Polytechnic College, Jolarpet, Thirupathur - 635651","Government Polytechnic College, Jolarpet, Thirupathur - 635651, Tirupathur, Tamil Nadu, India",https://www.google.com/maps/search/?api=1&query=Government+Polytechnic+College%2C+Jolarpet%2C+Thirupathur+-+635651%2C+Tirupathur%2C+Tamil+Nadu%2C+India,12.5242,78.5424,arcgis,"635651, Tiruppattur, Tamil Nadu",resolved
100,Tiruppur,25,Chikkanna Government Arts College Tirupur,641602,Chikkanna Government Arts College Tirupur 641602,"Chikkanna Government Arts College Tirupur 641602, Tiruppur, Tamil Nadu, India",https://www.google.com/maps/search/?api=1&query=Chikkanna+Government+Arts+College+Tirupur+641602%2C+Tiruppur%2C+Tamil+Nadu%2C+India,11.108091,77.318591,arcgis,Chikkanna Government Arts College,resolved
101,Tiruvannamalai,14,"Government Polytechnic College, Cheyyar-",604407,"Government Polytechnic College, Cheyyar- 604407","Government Polytechnic College, Cheyyar- 604407, Tiruvannamalai, Tamil Nadu, India",https://www.google.com/maps/search/?api=1&query=Government+Polytechnic+College%2C+Cheyyar-+604407%2C+Tiruvannamalai%2C+Tamil+Nadu%2C+India,12.580722,79.580528,arcgis,Government Polytechnic College,resolved
102,Tiruvannamalai,98,"University College of Engineering Arni, Arni","To Devikapuram Road, Thatchur Village, Arni, Taluk, Tiruvannamalai - 632326","University College of Engineering Arni, Arni To Devikapuram Road, Thatchur Village, Arni Taluk, Tiruvannamalai - 632326","University College of Engineering Arni, Arni To Devikapuram Road, Thatchur Village, Arni Taluk, Tiruvannamalai - 632326, Tamil Nadu, India",https://www.google.com/maps/search/?api=1&query=University+College+of+Engineering+Arni%2C+Arni+To+Devikapuram+Road%2C+Thatchur+Village%2C+Arni+Taluk%2C+Tiruvannamalai+-+632326%2C+Tamil+Nadu%2C+India,12.576113,79.276109,arcgis,"632326, Arani, Tamil Nadu",resolved
103,Vellore,12,Thanthai Periyar Govt Institute of Technology,Vellore-632002,Thanthai Periyar Govt Institute of Technology Vellore-632002,"Thanthai Periyar Govt Institute of Technology Vellore-632002, Tamil Nadu, India",https://www.google.com/maps/search/?api=1&query=Thanthai+Periyar+Govt+Institute+of+Technology+Vellore-632002%2C+Tamil+Nadu%2C+India,12.8797247,79.1235404,arcgis,Thanthai Periyar Government Institute Of Technology,resolved
104,Vellore,105,Thanthai Periyar E.V.Ramasamy,"Government Polytechnic College, Sivaramapuram, Vellore -632002","Thanthai Periyar E.V.Ramasamy Government Polytechnic College, Sivaramapuram, Vellore -632002","Thanthai Periyar E.V.Ramasamy Government Polytechnic College, Sivaramapuram, Vellore -632002, Tamil Nadu, India",https://www.google.com/maps/search/?api=1&query=Thanthai+Periyar+E.V.Ramasamy+Government+Polytechnic+College%2C+Sivaramapuram%2C+Vellore+-632002%2C+Tamil+Nadu%2C+India,12.8730883,79.1250169,arcgis,"632002, Bagayam, Tamil Nadu",resolved
105,Viluppuram,18,Govt Polytechnic College No 27,"Kandachipuram Main Road Arakandanallur, Post Tirukoilur Taluk",Govt Polytechnic College No 27 Kandachipuram Main Road Arakandanallur Post Tirukoilur Taluk,"Govt Polytechnic College No 27 Kandachipuram Main Road Arakandanallur Post Tirukoilur Taluk, Viluppuram, Tamil Nadu, India",https://www.google.com/maps/search/?api=1&query=Govt+Polytechnic+College+No+27+Kandachipuram+Main+Road+Arakandanallur+Post+Tirukoilur+Taluk%2C+Viluppuram%2C+Tamil+Nadu%2C+India,12.1397563,79.5396801,arcgis,"Viluppuram, Tamil Nadu",resolved
106,Viluppuram,106,University College of Engineering Tindivanam,"& Melpakkam Post, Tindivanam, Villupuram, Dt. - 604307","University College of Engineering Tindivanam & Melpakkam Post, Tindivanam, Villupuram Dt. - 604307","University College of Engineering Tindivanam & Melpakkam Post, Tindivanam, Villupuram Dt. - 604307, Viluppuram, Tamil Nadu, India",https://www.google.com/maps/search/?api=1&query=University+College+of+Engineering+Tindivanam+%26+Melpakkam+Post%2C+Tindivanam%2C+Villupuram+Dt.+-+604307%2C+Viluppuram%2C+Tamil+Nadu%2C+India,12.289472,79.719806,arcgis,University College Of Engineering,resolved
